{
  "schema_version": "1.0",
  "dataset_id": "retruthqa",
  "display_name": "ReTruthQA",
  "modality": "text",
  "source_url": "TODO_OFFICIAL_SOURCE_URL",
  "revision": "TODO_IMMUTABLE_REVISION",
  "license": "TODO_VERIFY_LICENSE",
  "fields": {
    "id": "id",
    "prompt": "question",
    "reference_answer": "answer",
    "group_id": "group_id",
    "metadata": ["domain", "category"]
  },
  "splits": [
    {
      "name": "dev",
      "path": "../raw/retruthqa/dev.jsonl",
      "format": "jsonl",
      "sha256": null,
      "count": null
    },
    {
      "name": "test",
      "path": "../raw/retruthqa/test.jsonl",
      "format": "jsonl",
      "sha256": null,
      "count": null
    }
  ],
  "notes": "Template only. Replace TODO values after obtaining the official release."
}
